question,option1,option2,option3,option4,answerIndex,explanation
高知県に多くの雨を夏に降らせる原因となるものについて、次の問いに答えなさい。夏の季節風は、おもにどの方位からふいてきますか。,南東,南西,北東,北西,0,夏の季節風は南東から吹き、湿った空気をもたらします。
夏の季節風に多くの水蒸気を送りこむ暖流の名を答えなさい。,黒潮,対馬海流,リマン海流,親潮,0,黒潮（日本海流）は、南から流れる暖流で、夏の雨の原因となります。
高知県の北側にある、けわしい山地の名を答えなさい。,四国山地,中国山地,紀伊山地,阿蘇山地,0,四国山地は高知県の北にあり、降水量に大きな影響を与えます。
高知市の気候グラフを見て、降水量が最も多いのは何月ですか。,6月,7月,8月,9月,3,グラフを見ると、降水量が最も多いのは9月です。
9月に、降水量が最も多くなる原因として、夏から秋の初めにかけて日本に影響をあたえるものとしてあげられるものは何ですか。,台風,高気圧,梅雨前線,秋雨前線,0,台風が来ます。
高知県で、ビニールハウスを利用してつくられているおもな野菜を3つ答えなさい。,ピーマン・なす・きゅうり,トマト・レタス・キャベツ,にんじん・だいこん・たまねぎ,ピーマン・レタス・にんじん,0,高知県ではピーマン・なす・きゅうりなどをビニールハウスで育てています。
ほかの産地と出荷する時期をずらすために行う早づくりのことを、何といいますか。また、この早づくりでは、春（A）から夏（B）にかけて、おもに野菜を取り入れます。A・Bにあてはまる季節の名を答えなさい。,促成栽培・冬・春,抑制栽培・春・夏,促成栽培・春・夏,抑制栽培・冬・春,0,促成栽培は冬から春にかけて早づくりを行い、他の産地と出荷時期をずらします。
貨物を積んだトラックを一度に何台も運べる船を何といいますか。,フェリー,貨物船,コンテナ船,タンカー,0,フェリーはトラックなどの車両を運ぶことができる船です。
1988年に開通し、岡山県と香川県を結ぶ橋を何といいますか。,瀬戸大橋,明石海峡大橋,しまなみ海道,大鳴門橋,0,瀬戸大橋は1988年に開通し、本州と四国を結ぶ重要な橋です。
